{
  "standard": "heritage-data-exchange",
  "version": "0.1.0",
  "generated_at": "2026-06-08T09:30:00Z",
  "sender_node_guid": "4f2a9c1e-8b3d-4f6a-9c2e-1a2b3c4d5e6f",
  "objects": [
    {
      "digital_object_guid": "9a8b7c6d-5e4f-4a3b-9c2d-1e0f1a2b3c4d",
      "entity_type": "Work",
      "digital_object_media_url": "https://collections.herzen.spb.ru/catalog/bonec",
      "local_identifier": "work-elbow-joint",
      "record_url": "https://collections.herzen.spb.ru/catalog/bonec",
      "created_at": "2026-06-08T09:10:00Z",
      "modified_at": "2026-06-08T09:14:00Z",
      "metadata": [
        {
          "key": "title",
          "value": "Оси вращения локтевого сустава",
          "language": "ru",
          "authority": "https://collections.herzen.spb.ru/bonec",
          "source_node_guid": "4f2a9c1e-8b3d-4f6a-9c2e-1a2b3c4d5e6f",
          "asserted_by_person_guid": "5a6b7c8d-9e0f-4a1b-8c2d-3e4f5a6b7c8d",
          "attribution_status": "expert_verified",
          "is_enabled_for_ai_using": true,
          "created_at": "2026-06-08T09:10:00Z",
          "modified_at": "2026-06-08T09:10:00Z"
        },
        {
          "key": "title",
          "value": "Axes of rotation of the elbow joint",
          "language": "en",
          "authority": "https://collections.herzen.spb.ru/bonec",
          "source_node_guid": "4f2a9c1e-8b3d-4f6a-9c2e-1a2b3c4d5e6f",
          "asserted_by_person_guid": "5a6b7c8d-9e0f-4a1b-8c2d-3e4f5a6b7c8d",
          "attribution_status": "expert_verified",
          "is_enabled_for_ai_using": true,
          "created_at": "2026-06-08T09:11:00Z",
          "modified_at": "2026-06-08T09:11:00Z"
        },
        {
          "key": "description",
          "value": "Модель локтевого сустава с выделенными осями вращения; абстрактная сущность, реализуемая цифровыми и физическими копиями.",
          "language": "ru",
          "authority": "https://collections.herzen.spb.ru/bonec",
          "source_node_guid": "4f2a9c1e-8b3d-4f6a-9c2e-1a2b3c4d5e6f",
          "asserted_by_person_guid": "5a6b7c8d-9e0f-4a1b-8c2d-3e4f5a6b7c8d",
          "attribution_status": "expert_verified",
          "is_enabled_for_ai_using": false,
          "created_at": "2026-06-08T09:12:00Z",
          "modified_at": "2026-06-08T09:12:00Z"
        }
      ],
      "classification": [
        {
          "code": "anatomical-models",
          "authority": "https://heritage.example.org/ns/classifier/v1",
          "source_node_guid": "4f2a9c1e-8b3d-4f6a-9c2e-1a2b3c4d5e6f",
          "asserted_by_person_guid": "5a6b7c8d-9e0f-4a1b-8c2d-3e4f5a6b7c8d",
          "created_at": "2026-06-08T09:13:00Z",
          "modified_at": "2026-06-08T09:13:00Z"
        }
      ],
      "license": [
        {
          "code": "CC-BY-4.0",
          "authority": "https://creativecommons.org/licenses/by/4.0/legalcode",
          "source_node_guid": "4f2a9c1e-8b3d-4f6a-9c2e-1a2b3c4d5e6f",
          "asserted_by_person_guid": "5a6b7c8d-9e0f-4a1b-8c2d-3e4f5a6b7c8d",
          "created_at": "2026-06-08T09:13:00Z",
          "modified_at": "2026-06-08T09:13:00Z"
        }
      ]
    },
    {
      "digital_object_guid": "1f2e3d4c-5b6a-4c7d-9e8f-0a1b2c3d4e5f",
      "digital_object_media_url": "https://storage.yandexcloud.net/techopark-bucket-exposition/bonec/",
      "local_identifier": "bonec",
      "record_url": "https://collections.herzen.spb.ru/catalog/bonec",
      "created_at": "2026-06-08T09:15:00Z",
      "modified_at": "2026-06-08T09:18:00Z",
      "metadata": [
        {
          "key": "title",
          "value": "Оси вращения локтевого сустава",
          "language": "ru",
          "authority": "https://collections.herzen.spb.ru/bonec",
          "source_node_guid": "4f2a9c1e-8b3d-4f6a-9c2e-1a2b3c4d5e6f",
          "asserted_by_person_guid": "5a6b7c8d-9e0f-4a1b-8c2d-3e4f5a6b7c8d",
          "attribution_status": "expert_verified",
          "created_at": "2026-06-08T09:15:00Z",
          "modified_at": "2026-06-08T09:15:00Z",
          "is_enabled_for_ai_using": true
        },
        {
          "key": "title",
          "value": "Axes of rotation of the elbow joint",
          "language": "en",
          "authority": "https://collections.herzen.spb.ru/bonec",
          "source_node_guid": "4f2a9c1e-8b3d-4f6a-9c2e-1a2b3c4d5e6f",
          "asserted_by_person_guid": "5a6b7c8d-9e0f-4a1b-8c2d-3e4f5a6b7c8d",
          "attribution_status": "expert_verified",
          "created_at": "2026-06-08T09:16:00Z",
          "modified_at": "2026-06-08T09:16:00Z",
          "is_enabled_for_ai_using": true
        },
        {
          "key": "description",
          "value": "Модель локтевого сустава с выделенными осями вращения позволяет наглядно изучить сложную биомеханику сочленения плечевой, локтевой и лучевой костей. Необходима для понимания движений верхней конечности.",
          "language": "ru",
          "authority": "https://collections.herzen.spb.ru/bonec",
          "source_node_guid": "4f2a9c1e-8b3d-4f6a-9c2e-1a2b3c4d5e6f",
          "asserted_by_person_guid": "5a6b7c8d-9e0f-4a1b-8c2d-3e4f5a6b7c8d",
          "attribution_status": "expert_verified",
          "created_at": "2026-06-08T09:17:00Z",
          "modified_at": "2026-06-08T09:17:00Z",
          "is_enabled_for_ai_using": false
        }
      ],
      "classification": [
        {
          "code": "anatomical-models",
          "authority": "https://heritage.example.org/ns/classifier/v1",
          "source_node_guid": "4f2a9c1e-8b3d-4f6a-9c2e-1a2b3c4d5e6f",
          "asserted_by_person_guid": "5a6b7c8d-9e0f-4a1b-8c2d-3e4f5a6b7c8d",
          "created_at": "2026-06-08T09:18:00Z",
          "modified_at": "2026-06-08T09:18:00Z"
        }
      ],
      "license": [
        {
          "code": "CC-BY-4.0",
          "authority": "https://creativecommons.org/licenses/by/4.0/legalcode",
          "source_node_guid": "4f2a9c1e-8b3d-4f6a-9c2e-1a2b3c4d5e6f",
          "asserted_by_person_guid": "5a6b7c8d-9e0f-4a1b-8c2d-3e4f5a6b7c8d",
          "created_at": "2026-06-08T09:20:00Z",
          "modified_at": "2026-06-08T09:20:00Z"
        }
      ],
      "entity_type": "Manifestation",
      "work_guid": "9a8b7c6d-5e4f-4a3b-9c2d-1e0f1a2b3c4d"
    }
  ],
  "persons": [
    {
      "person_guid": "5a6b7c8d-9e0f-4a1b-8c2d-3e4f5a6b7c8d",
      "owner_node_guid": "4f2a9c1e-8b3d-4f6a-9c2e-1a2b3c4d5e6f",
      "full_name": "Иван Макаров",
      "language": "ru",
      "metadata": [
        {
          "key": "role",
          "value": "эксперт-атрибутор; создатель объектов цифрового культурного наследия",
          "language": "ru",
          "authority": "https://heritage.example.org/ns/metadata/v1#role",
          "source_node_guid": "4f2a9c1e-8b3d-4f6a-9c2e-1a2b3c4d5e6f",
          "asserted_by_person_guid": "5a6b7c8d-9e0f-4a1b-8c2d-3e4f5a6b7c8d",
          "attribution_status": "authoritative",
          "created_at": "2026-06-08T09:10:00Z",
          "modified_at": "2026-06-08T09:10:00Z"
        }
      ]
    }
  ]
}